{
  "contract_version": "health-manager.mvp90.object-model.v1",
  "module_id": "health-manager",
  "model_kind": "product-semantics-not-api-or-database",
  "source": {
    "prd_id": "HM-MVP90-PRD-V1",
    "exact_commit": "fdf080f7ab03b2bdba87b77a7b3fd33dbcc8f73c",
    "sha256": "701ee042f88a156a2c393e7b64bbbea7a4b54c0e94a81be8ea83d8cb05c1e147",
    "status": "document-handoff-ready-professional-freeze-pending"
  },
  "objects": [
    {"object_id":"MemberServiceRelationship","version":"v1","name_zh":"会员服务关系","owner":"平台与运营","required_semantics":["member_ref","manager_ref","service_status","starts_at","ends_at","product_ref"],"forbidden_fields":["automatic_record_deletion_on_expiry","automatic_risk_closure_on_expiry"],"config_refs":[]},
    {"object_id":"ConsentGrant","version":"v1","name_zh":"授权","owner":"会员","required_semantics":["subject_ref","purpose","data_scope","recipient_roles","validity_ref","status","version"],"forbidden_fields":["implicit_consent","purpose_scope_conflation"],"config_refs":["config://health.consent.validity-policy"]},
    {"object_id":"HealthProfileItem","version":"v1","name_zh":"健康档案项","owner":"会员、管理师或专业人员","required_semantics":["content_ref","item_type","source_ref","occurred_or_collected_at","confirmation_status","correction_chain"],"forbidden_fields":["silent_candidate_promotion","source_overwrite"],"config_refs":[]},
    {"object_id":"AssessmentSession","version":"v1","name_zh":"测评会话","owner":"会员、系统与人工复核者","required_semantics":["rule_ref","question_version","answer_refs","missing_items","safety_screening_result","routing_result"],"forbidden_fields":["diagnosis","missing_data_default"],"config_refs":["config://health.assessment.rule-version"]},
    {"object_id":"HealthGoal","version":"v1","name_zh":"健康目标","owner":"会员与管理师","required_semantics":["description","priority","period_ref","success_observation","status"],"forbidden_fields":["purchase_only_success","checkin_only_success","single_metric_only_success"],"config_refs":["config://health.goal.period-policy"]},
    {"object_id":"HealthPlan","version":"v1","name_zh":"健康计划","owner":"管理师与会员","required_semantics":["current_version_ref","goal_refs","period_ref","relationship_ref","status"],"forbidden_fields":["multiple_current_versions","history_overwrite"],"config_refs":["config://health.plan.period-policy"]},
    {"object_id":"HealthPlanVersion","version":"v1","name_zh":"计划版本","owner":"AI 起草、管理师或专业人员审核、会员确认","required_semantics":["version_number","draft_source","action_refs","check_refs","stop_condition_refs","adjustment_basis","review_record","member_confirmation"],"forbidden_fields":["unconfirmed_activation","unsigned_professional_content","previous_version_overwrite"],"config_refs":["config://health.plan.stop-condition-policy"]},
    {"object_id":"HealthTask","version":"v1","name_zh":"健康任务","owner":"系统","required_semantics":["plan_version_ref","action","planned_date","stop_condition_refs","status"],"forbidden_fields":["orphan_task","multiple_primary_actions"],"config_refs":["config://health.task.schedule-policy"]},
    {"object_id":"TaskFeedback","version":"v1","name_zh":"任务反馈","owner":"会员","required_semantics":["member_choice","difficulty","discomfort","note_ref","reported_at","source_ref"],"forbidden_fields":["original_text_overwrite","ai_summary_as_original"],"config_refs":[]},
    {"object_id":"CheckRecord","version":"v1","name_zh":"检查记录","owner":"系统与管理师","required_semantics":["subject_ref","observation","deviation","source_refs","conclusion_type","responsible_actor_ref"],"forbidden_fields":["diagnosis","treatment_effect_claim"],"config_refs":[]},
    {"object_id":"RiskEvent","version":"v1","name_zh":"风险事件","owner":"合格人员","required_semantics":["source_ref","original_description_ref","rule_version_ref","provisional_level","status","responsible_actor_ref","measure_refs","review_record"],"forbidden_fields":["ai_professional_close","ai_emergency_close","message_as_resolution"],"config_refs":["config://health.risk.rule-version","config://health.risk.response-policy"]},
    {"object_id":"HumanHandoff","version":"v1","name_zh":"转人工事件","owner":"系统、会员或人员发起，合格人员接管","required_semantics":["trigger_reason","minimal_context_ref","target_role","queue_status","assignee_ref","result_ref","recovery_point"],"forbidden_fields":["sent_as_accepted","unqualified_takeover","full_profile_by_default"],"config_refs":["config://health.handoff.capacity-policy"]},
    {"object_id":"CommunicationRecord","version":"v1","name_zh":"沟通记录","owner":"人工服务角色","required_semantics":["participant_roles","channel","sent_status","delivery_status","reply_status","content_source_ref","next_step"],"forbidden_fields":["sent_as_delivered","delivered_as_resolved","message_body_in_general_log"],"config_refs":["config://health.communication.channel-policy","config://health.communication.retry-policy"]},
    {"object_id":"ServiceRecord","version":"v1","name_zh":"服务记录","owner":"实际服务责任方","required_semantics":["service_type","provider_ref","performed_at","process_ref","result_ref","exception_refs","follow_up"],"forbidden_fields":["order_as_professional_result","redemption_as_professional_result"],"config_refs":[]},
    {"object_id":"TemplateVersion","version":"v1","name_zh":"模板版本","owner":"内容维护者与独立审核人","required_semantics":["template_type","applicability","contraindication_refs","review_status","version_number","validity_ref"],"forbidden_fields":["same_person_approval","unreviewed_use","expired_use"],"config_refs":["config://health.template.validity-policy"]},
    {"object_id":"AuditEvent","version":"v1","name_zh":"审计事件","owner":"平台","required_semantics":["actor_ref","actor_role","action","object_ref","occurred_at","outcome","reason","correlation_id"],"forbidden_fields":["health_body","secret","otp","jwt","cookie","unnecessary_personal_identifier"],"config_refs":[]}
  ],
  "pending_decisions": [
    {"decision_id":"C4-P08","status":"pending-with-owner","owner":"产品负责人；医生集团专业、法律/隐私","executable":false,"blocks":["real_member_admission"]},
    {"decision_id":"C4-H01","status":"pending-with-owner","owner":"和奥堂医生集团专业负责人","executable":false,"blocks":["professional_action_policy"]},
    {"decision_id":"C4-H02","status":"pending-with-owner","owner":"医疗质量负责人","executable":false,"blocks":["risk_rule_execution"]},
    {"decision_id":"C4-H03","status":"pending-with-owner","owner":"医生集团医疗质量负责人","executable":false,"blocks":["emergency_sla_and_roster"]},
    {"decision_id":"C4-H04","status":"pending-with-owner","owner":"健康管理专业负责人","executable":false,"blocks":["manager_qualification_policy"]},
    {"decision_id":"C4-H05","status":"pending-with-owner","owner":"老年、康复、药学专业负责人","executable":false,"blocks":["fall_prevention_program"]},
    {"decision_id":"C4-H06","status":"pending-with-owner","owner":"对应专业负责人","executable":false,"blocks":["professional_template_execution"]},
    {"decision_id":"C4-H07","status":"pending-with-owner","owner":"医生集团专业负责人","executable":false,"blocks":["external_pdcar_language"]},
    {"decision_id":"C4-L02","status":"pending-with-owner","owner":"隐私与法律负责人","executable":false,"blocks":["retention_export_deletion_policy"]},
    {"decision_id":"C4-L03","status":"pending-with-owner","owner":"隐私与法律负责人","executable":false,"blocks":["minor_or_proxy_flow"]},
    {"decision_id":"C4-L04","status":"pending-with-owner","owner":"隐私与法律负责人","executable":false,"blocks":["ai_data_use_policy"]},
    {"decision_id":"C4-L05","status":"pending-with-owner","owner":"隐私与法律负责人","executable":false,"blocks":["external_data_processing"]},
    {"decision_id":"C4-L06","status":"pending-with-owner","owner":"医生集团法务与负责人","executable":false,"blocks":["legal_medical_responsibility"]},
    {"decision_id":"C4-S04","status":"pending-with-owner","owner":"平台安全负责人","executable":false,"blocks":["final_scope_and_threat_model"]},
    {"decision_id":"C4-S05","status":"pending-with-owner","owner":"AI 与平台安全负责人","executable":false,"blocks":["ai_safety_runtime"]},
    {"decision_id":"C4-S07","status":"pending-with-owner","owner":"平台安全与运维负责人","executable":false,"blocks":["real_data_pilot_environment"]},
    {"decision_id":"C4-O01","status":"pending-with-owner","owner":"运营负责人","executable":false,"blocks":["capacity_assignment"]},
    {"decision_id":"C4-O02","status":"pending-with-owner","owner":"运营负责人","executable":false,"blocks":["response_and_message_timing"]},
    {"decision_id":"C4-O03","status":"pending-with-owner","owner":"商业负责人","executable":false,"blocks":["pricing_and_entitlements"]},
    {"decision_id":"C4-O04","status":"pending-with-owner","owner":"运营与商业负责人","executable":false,"blocks":["points_and_growth"]},
    {"decision_id":"C4-O05","status":"pending-with-owner","owner":"产品与运营负责人","executable":false,"blocks":["formal_success_thresholds"]},
    {"decision_id":"C4-O06","status":"pending-with-owner","owner":"运营负责人","executable":false,"blocks":["real_member_pilot"]},
    {"decision_id":"C4-O07","status":"pending-with-owner","owner":"采购与运营负责人","executable":false,"blocks":["external_provider_pool"]},
    {"decision_id":"C4-T03","status":"pending-with-owner","owner":"平台集成负责人","executable":false,"blocks":["business_implementation"]},
    {"decision_id":"C4-T04","status":"pending-with-owner","owner":"平台与运维负责人","executable":false,"blocks":["performance_and_release_gate"]},
    {"decision_id":"C4-T05","status":"pending-with-owner","owner":"平台发布负责人","executable":false,"blocks":["deployment_and_production"]},
    {"decision_id":"C4-T06","status":"pending-with-owner","owner":"平台集成负责人、医生集团专业负责人","executable":false,"blocks":["hm_r0_formal_freeze"]}
  ]
}
